Authors,Author full names,Author(s) ID,Title,Year,Source title,Volume,Issue,Art. No.,Page start,Page end,Cited by,DOI,Link,Abstract,Author Keywords,Index Keywords,Document Type,Publication Stage,Open Access,Source,EID
Azeta A.A.; Ikhu-Omoreghe N.A.; Ayo C.K.; Atayero A.A.,"Azeta, A.A. (24069688600); Ikhu-Omoreghe, N.A. (57210043747); Ayo, C.K. (8601910400); Atayero, A.A. (57213351151)",24069688600; 57210043747; 8601910400; 57213351151,A software engineered voice-enabled job recruitment portal system,2008,European Journal of Scientific Research,21,1,,95,103,1,,https://www.scopus.com/pages/publications/54149084759?origin=resultslist,"The inability of job seekers to get timely job information regarding the status of the application submitted via conventional job portal system which is usually dependent on accessibility to the Internet has made so many job applicants to lose their placements. Worse still, the epileptic services offered by Internet Service Providers and the poor infrastructures in most developing countries have greatly hindered the expected benefits from Internet usage. These have led to cases of online vacancies notifications unattended to simply because a job seeker is neither aware nor has access to the Internet. With an increasing patronage of mobile phones, a self-service job vacancy notification with audio functionality or an automated job vacancy notification to all qualified job seekers through mobile phones will simply provide a solution to these challenges. In this paper, we present a Voice-enabled Job Recruitment Portal (JRP) System. The system is accessed through two interfaces - the voice user's interface (VUI) and web interface. The VUI was developed using VoiceXML and the web interface using PHP, and both interfaces integrated with Apache and MySQL as the middleware and back-end component respectively. The JRP proposed in this paper takes the hassle of job hunting from job seekers, provides job status information in real-time to the job seeker and offers other benefits such as, cost, effectiveness, speed, accuracy, ease of documentation, convenience and better logistics to the employer in seeking the right candidate for a job. © EuroJournals Publishing, Inc. 2008.",Real-time; Recruitment; Voice and portal; VoiceXML; Web,,Article,Final,,Scopus,2-s2.0-54149084759
Winkler D.; Meixner K.; Lehner D.; Biffl S.,"Winkler, Dietmar (57210102724); Meixner, Kristof (57204805351); Lehner, Daniel (57212391238); Biffl, Stefan (6701704981)",57210102724; 57204805351; 57212391238; 6701704981,Test Reporting at a Large-Scale Austrian Logistics Organization: Lessons Learned and Improvement,2019,Lecture Notes in Computer Science (including subseries Lecture Notes in Artificial Intelligence and Lecture Notes in Bioinformatics),11915 LNCS,,,53,69,0,10.1007/978-3-030-35333-9_4,https://www.scopus.com/pages/publications/85076536688?origin=resultslist,"Context and Background. Software testing and test automation are important activities in software development where frequent requirements changes and the fast delivery of software increments are supported by traditional and agile development processes. Test reports are often used as “proof of evidence” for executed software tests. However, the practical impact of test reports, such as decision making and quality assessment, requires structured information which might not be available in sufficient quality. Goal. In this paper we (a) report on needs of test reports of different stakeholders at a large-scale Austrian logistics organization, (b) develop candidate improvement actions based on the state of the practice, and (c) conceptually evaluate selected improvement actions. Method. We used surveys and interviews to elicit needs and expected capabilities for test reporting and developed candidate improvement. We used expert discussions prioritize improvement actions in the organization context for further implementation. Results. Based on 23 recommended improvement actions, 14 were initially selected for implementation. Most of these accepted improvement action focus on regular test status reports and visualization aspects of test reports. Conclusion. Although test reporting is systematically applied in development processes, there is still some potential to improve test reports to gain (additional) benefits for related stakeholder. © Springer Nature Switzerland AG 2019.",Case study; Engineering process improvement; Software testing; Test reporting,Decision making; Process engineering; Software design; Agile development; Development process; Engineering process; Quality assessment; Requirements change; State of the practice; Structured information; Test Automation; Software testing,Conference paper,Final,,Scopus,2-s2.0-85076536688
Gajanayake R.G.U.S.; Hiras M.H.M.; Gunathunga P.I.N.; Janith Supun E.G.; Karunasenna A.; Bandara P.,"Gajanayake, R.G.U.S. (57222353937); Hiras, M.H.M. (57222353368); Gunathunga, P.I.N. (57222359699); Janith Supun, E.G. (57222354144); Karunasenna, Anuradha (52163544800); Bandara, Pradeepa (56631524900)",57222353937; 57222353368; 57222359699; 57222354144; 52163544800; 56631524900,Candidate selection for the interview using github profile and user analysis for the position of software engineer,2020,"ICAC 2020 - 2nd International Conference on Advancements in Computing, Proceedings",,,9357279,168,173,9,10.1109/ICAC51239.2020.9357279,https://www.scopus.com/pages/publications/85102473530?origin=resultslist,"Selecting the most suitable candidates for interviews is an important process for organizations that can affect their overall work performance. Typically, recruiters check Curriculum Vitae (CV), shortlist them and call candidates for interviews which have been the way of recruiting new employees for a long time. To minimize the time spent on the above process, pre-screening mechanisms are nowadays implemented by organizations. However, those mechanisms need sufficient information to evaluate the candidate. For example, in case of a software engineer, the recruiters are interested on the programming ability, academic performance as well as personality traits of potential candidates. In this research, a pre-screening solution is proposed to screen the applicants for the post of Software Engineer where candidates are screen based on an initial call transcript, GitHub profile, LinkedIn profile, CV, Academic transcript and, Recommendation letters. This approach extracts textual features of different dimensions based on Natural Language Processing to identify the Big Five personality traits, CV and GitHub insights, candidate's skills, background, and capabilities from Recommendation letters as well as programming skills and knowledge from Academic transcript and Linked Profile. The results obtained from the different areas are presented and shown that the selected supervised machine learning algorithms and techniques can be used to evaluate the best possible candidates. © 2020 IEEE.",Academic Transcript; Big five personality; Candidate Selection; Curriculum Vitae; GitHub; LinkedIn; Machine Learning Algorithms; Questionnaire; Recommendation,Engineers; Natural language processing systems; Supervised learning; Academic performance; Candidate selection; NAtural language processing; Personality traits; Pre-screening mechanism; Programming ability; Programming skills; Supervised machine learning; Learning algorithms,Conference paper,Final,,Scopus,2-s2.0-85102473530
Chen A.; Huo T.; Nam Y.; Port D.; Peruma A.,"Chen, Alyssia (59008976000); Huo, Timothy (59330400900); Nam, Yunhee (59341513600); Port, Dan (6701426862); Peruma, Anthony (57194647753)",59008976000; 59330400900; 59341513600; 6701426862; 57194647753,"The Impact of Generative AI-Powered Code Generation Tools on Software Engineer Hiring: Recruiters' Experiences, Perceptions, and Strategies",2025,Proceedings of the Annual Hawaii International Conference on System Sciences,,,,7227,7236,0,,https://www.scopus.com/pages/publications/105005154979?origin=resultslist,"The rapid advancements in Generative AI (GenAI) tools, such as ChatGPT and GitHub Copilot, are transforming software engineering by automating code generation tasks. While these tools improve developer productivity, they also present challenges for organizations and hiring professionals in evaluating software engineering candidates' true abilities and potential. Although there is existing research on these tools in both industry and academia, there is a lack of research on how these tools specifically affect the hiring process. Therefore, this study aims to explore recruiters' experiences and perceptions regarding GenAI-powered code generation tools, as well as their challenges and strategies for evaluating candidates. Findings from our survey of 32 industry professionals indicate that although most participants are familiar with such tools, the majority of organizations have not adjusted their candidate evaluation methods to account for candidates' use/knowledge of these tools. There are mixed opinions on whether candidates should be allowed to use these tools during interviews, with many participants valuing candidates who can effectively demonstrate their skills in using these tools. Additionally, most participants believe that it is important to incorporate GenAI-powered code generation tools into computer science curricula and mention the key risks and benefits of doing so. © 2025 IEEE Computer Society. All rights reserved.",code generation; generative AI; hiring in computing; practitioner survey; recruiter,Computer systems programming; Machine oriented languages; Professional aspects; Software packages; Software quality; Verification; Code generation tools; Codegeneration; Evaluating software; Evaluation methods; Generative AI; Hiring in computing; Hiring process; Industry professionals; Practitioner surveys; Recruiter; Software design,Conference paper,Final,,Scopus,2-s2.0-105005154979
Eckhardt A.; Brickwedde W.; Laumer S.; Weitzel T.,"Eckhardt, Andreas (24484722800); Brickwedde, Wolfgang (60031300300); Laumer, Sven (24484821200); Weitzel, Tim (6701616351)",24484722800; 60031300300; 24484821200; 6701616351,The need for a recruiter 2.0 for hiring IT talent: The case of a German software manufacturer,2011,Managing IT Human Resources: Considerations for Organizations and Personnel,,,,325,339,3,10.4018/978-1-60960-535-3.ch022,https://www.scopus.com/pages/publications/105012692544?origin=resultslist,"In times like the current economic downturn, just like when there is growth, companies struggle to meet the challenge of an IT talent shortage as recruitment and HR in general undergo dramatic changes in the methods applied to find suitable candidates and the services provided to internal and external clients. The IT recruiter's job profile has changed dramatically in the Web 2.0 era, as searching for candidates via LinkedIn and Facebook or micro-blogging via Twitter have become part of the recruiter's daily tools. Apart from all the technical and organizational changes involved, it is still unknown how recruiters and their skill sets will be transformed into those of recruiters 2.0. The purpose of this chapter is to present the case of a German software manufacturer who invented a Recruiter Training Academy to fulfill their IT recruiters' need for new and specific skills. © 2011, IGI Global. All rights reserved.",,Employment; Software engineering; 'current; Economic downturn; Facebook; LinkedIn; Micro blogging; Organizational change; Skill sets; Technical change; Web 2.0; Personnel training,Book chapter,Final,,Scopus,2-s2.0-105012692544
Kamruzzaman M.; Kim G.L.,"Kamruzzaman, Mahammed (59633068800); Kim, Gene Louis (57198353939)",59633068800; 57198353939,The Impact of Disability Disclosure on Fairness and Bias in LLM-Driven Candidate Selection,2025,"Proceedings of the International Florida Artificial Intelligence Research Society Conference, FLAIRS",38,,,,,1,10.32473/flairs.38.1.138911,https://www.scopus.com/pages/publications/105007927307?origin=resultslist,"As large language models (LLMs) become increasingly integrated into hiring processes, concerns about fairness have gained prominence. When applying for jobs, companies often request/require demographic information, including gender, race, and disability or veteran status. This data is collected to support diversity and inclusion initiatives, but when provided to LLMs, especially disability-related information, it raises concerns about potential biases in candidate selection outcomes. Many studies have highlighted how disability can impact CV screening, yet little research has explored the specific effect of voluntarily disclosed information on LLM-driven candidate selection. This study seeks to bridge that gap. When candidates shared identical gender, race, qualifications, experience, and backgrounds, and sought jobs with minimal employment rate gaps between individuals with and without disabilities (e.g., Cashier, Software Developer), LLMs consistently favored candidates who disclosed that they had no disability. Even in cases where candidates chose not to disclose their disability status, the LLMs were less likely to select them compared to those who explicitly stated they did not have a disability. Copyright © 2025 by the authors.",,Software engineering; Candidate selection; Demographic information; Employment rates; Hiring process; Language model; Model-driven; Software developer; Specific effects; Screening,Conference paper,Final,All Open Access; Gold Open Access; Green Open Access,Scopus,2-s2.0-105007927307
Campero S.,"Campero, Santiago (57193167536)",57193167536,Racial disparities in the screening of candidates for software engineering internships,2023,Social Science Research,109,,102773,,,4,10.1016/j.ssresearch.2022.102773,https://www.scopus.com/pages/publications/85135554870?origin=resultslist,"Internships are a common way for firms to hire college-educated workers, prompting concerns about how internship hiring affects various forms of inequality in the transition from school to work. Some of these concerns center on whether internships might be less accessible for workers from non-white racial groups. In this paper, I examine racial disparities in internship hiring and argue that, relative to full-time hiring, in internship hiring firms have less information about candidates’ qualifications and are also less motivated to screen candidates intensely. Therefore, group-based status beliefs play a larger role in the screening of intern candidates than in the screening of full-time candidates, leading to larger disadvantages for low-status workers (i.e., non-white workers). I examine these claims using data from a Silicon Valley software firm recruiting for both software engineering internships and entry-level software engineering positions. I find evidence consistent with such “cursory screening” of intern candidates leading to non-white (i.e., Asian, Hispanic, Black) job candidates being more strongly disadvantaged relative to white candidates in competing for internships as compared with full-time positions. © 2022 Elsevier Inc.",,Employment; Hispanic or Latino; Humans; Internship and Residency; Racial Groups; Software; United States; ancestry group; employment; human; medical education; software; United States,Article,Final,,Scopus,2-s2.0-85135554870
Ren J.; Li A.,"Ren, Jianfeng (59905067500); Li, Andric (59408607300)",59905067500; 59408607300,"Silicon Valley Python engineer interview guide: Data structure, algorithm, and system design",2025,"Silicon Valley Python Engineer Interview Guide: Data Structure, Algorithm, and System Design",,,,1,481,1,10.1007/978-981-96-3201-5,https://www.scopus.com/pages/publications/105005568261?origin=resultslist,"Silicon Valley Python Interview Guide: Data Structures, Algorithms, and System Design is an essential resource for aspiring software engineers preparing for technical interviews at top-tier companies. This book provides a comprehensive roadmap, covering foundational concepts, practical coding techniques, and advanced problem-solving strategies to help candidates excel in interviews. With a focus on Python, the book equips readers with the skills to tackle challenging coding problems, design scalable systems, and communicate solutions effectively. In the first half, the book delves into core data structures (lists, stacks, queues, graphs, and trees) and algorithms (binary search, dynamic programming, DFS, BFS, and backtracking),offering practical examples and Python implementations. The latter half transitions to system design, including big data architectures, distributed systems, and machine learning workflows. Case studies on real-world applications like Tiny URL, autocomplete systems, and Chat GPT-like models provide hands-on insights. Whether you are an early-career engineer or an experienced professional, this guide is designed to enhance your preparation with real-world examples, tested code, and proven strategies. It is more than a technical handbook-it is your roadmap to building confidence and securing a role in the competitive tech industry. © China Machine Press Co., Ltd. 2025. All rights reserved.",Algorithms; Big data architecture; Binary indexed tree (BIT); Binary search; Breadth-first search (BFS); Data structures; Depth-first search (DFS); Dynamic programming; Generative AI; Interview preparation; Machine learning; Multi-threading; Python programming; Scalability; Segment tree; System design; Technical interview; Trie (Prefix Tree); Two-pointer method; Union-find,Client server computer systems; Cloud computing; Cluster computing; Grid computing; Message passing; Registration of engineers; Scalability; Search engines; Service oriented architecture (SOA); Big data architecture; Binary indexed tree; Binary search; Breadth-first search; Breadth-first-search; Data architectures; Depth first; Depth-first search; Generative AI; Interview preparation; Machine-learning; Multi-threading; Prefix trees; Python programming; Segment tree; Technical interview; Trie (prefix tree); Two-pointer method; Union-Find; Python,Book,Final,All Open Access; Gold Open Access,Scopus,2-s2.0-105005568261
Muke S.; Ahire S.; Kale G.; Navghare P.,"Muke, Saurav (59007705300); Ahire, Samruddhi (59008521200); Kale, Geetanjali (55446294200); Navghare, Pranali (57228225800)",59007705300; 59008521200; 55446294200; 57228225800,ICode-An Unified Competitive Coding Profile Platform,2024,"2024 International Conference on Emerging Smart Computing and Informatics, ESCI 2024",,,,,,6,10.1109/ESCI59607.2024.10497289,https://www.scopus.com/pages/publications/85191719183?origin=resultslist,"Although a software developer is capable of creating excellent software without the necessity for competitive coding. Having their hands in it may increase the project's efficiency and scalability. For every developer, problem solving is a must-required skill that is gained through competitive coding. Many technical recruiters use competitive programming as a barometer to assess a candidate's potential for the post of software engineer, including many prestigious Silicon Valley companies like Google, Facebook,etc. Since there is no such platform that helps students showcase their coding status on every registered platform, the proposed system helps to have such. ICode is a unified platform to help students visualize their coding profile status on a single site at one go. There is no public API that can be used to retrieve the data.from websites; hence, web scraping becomes relevant in this situation. It is one of the strategies of information retrieval.lnstead of manually copying data from the browser, with web scraping, it becomes easy to automatically extract the data. without any effort and perform analysis on it. The paper mainly targets the visualization of the data scrapped from competitive coding platforms to create a digital resume and perform analysis based on the scraped data. This is a digital resume.will be a revolution in the modern-day recruitment process since it will contain realtime user's details and coding platform ratings. and their analysis, project information, and digital bridges to platforms like Github and LinkedIn, where recruiters can actually review the users's information in a better way as compared to the old paper resume.  © 2024 IEEE.",API; data; data analysis; retrieval; visualisation; web scraping; websites,Data visualization; Visualization; API; Coding platform; Data; Digital resumes; Problem-solving; Project efficiency; Retrieval; Silicon valley; Software developer; Web scrapings; Websites,Conference paper,Final,,Scopus,2-s2.0-85191719183
Nagajyothi D.; Ali S.A.; Sree P.H.; Chinthapalli P.,"Nagajyothi, D. (57219333438); Ali, Shaik Ashik (58236440300); Sree, Parimi Hema (58573244500); Chinthapalli, Praharsha (58236211900)",57219333438; 58236440300; 58573244500; 58236211900,Automatic Personality Recognition In Interviews Using CNN,2023,"2023 4th IEEE Global Conference for Advancement in Technology, GCAT 2023",,,,,,2,10.1109/GCAT59970.2023.10353423,https://www.scopus.com/pages/publications/85182570126?origin=resultslist,"Due to the pandemic, various industries are facing significant challenges. The IT sector is also struggling with recruitment processes due to the difficulties associated with analyzing candidates online. Consequently, automated video interview analysis has emerged as an active research topic, which can help identify specific personality traits. Convolutional neural network models based on DL techniques have been developed due to advancements of CV and pattern recognition, and this technology has various applications in areas such as personality computing, psychological testing, and human computer interaction. These models accurately detect nonverbal cues and ascribe personality traits to individuals using a camera. With the help of AI-based interview agents, organizations can either replace or supplement the current self-reported personality evaluation tools that job candidates often manipulate to obtain socially acceptable results. The development of an AI-based interviewing system involved the use of asynchronous video interviews (AVIs) and the application of a personality prediction model trained on the first impression v2 dataset. The objective was to achieve automated personality recognition (APR) through the extraction of relevant features from the AVIs and the use of genuine personality scores obtained from facial expressions. This was achieved through the utilization of the VGG-16 network to train the model for improved accuracy in personality prediction. © 2023 IEEE.",Artificial Intelligence(AI); Asynchronous Video Interviews(AVI); Computer Vision(CV); Convolutional Neural Networks(CNN); Deep Learning(DL),Convolution; Convolutional neural networks; Deep learning; Human computer interaction; Asynchronoi video interview; Automated video; Convolutional neural network; Deep learning; Interview analysis; Personality predictions; Personality recognition; Personality traits; Recruitment process; Research topics; Computer vision,Conference paper,Final,,Scopus,2-s2.0-85182570126
Khalil S.,"Khalil, Sana (58813825700)",58813825700,Gender and neighborhood penalties in Karachi’s information technology sector,2025,Journal of Behavioral and Experimental Economics,119,,102469,,,0,10.1016/j.socec.2025.102469,https://www.scopus.com/pages/publications/105020991810?origin=resultslist,"This paper examines how gender and residential socioeconomic status shape hiring outcomes in Karachi’s information technology sector. Employers in Pakistan can openly state preferences regarding gender, residential location, and other characteristics, but the majority in the information technology sector choose not to do so. This creates an opportunity to examine whether discrimination persists when such biases are not explicitly stated. An analysis of explicitly gender-targeted job ads shows that men are preferred over women across most occupations, even in traditionally pink-collar roles. Moreover, results from a resume audit experiment, submitting 2,032 applications to 508 full-time job openings, show that men receive more callbacks for job interviews than women, even in the absence of explicit gender preferences in job ads. The study also indicates a significant premium favoring candidates from high-income areas, who receive 45 % more callbacks than applicants from low-income neighborhoods. This advantage remains robust even after controlling for commuting distance. Qualitative interviews with human resource officials suggest that employers associate productivity with both gender and neighborhood socioeconomic status. Residential address acts as a proxy for class background and signals education, skills, and perceived “fit” in professional settings. These perceptions may reinforce stereotypes, disadvantaging women and candidates from low-income backgrounds. Copyright © 2025. Published by Elsevier Inc.",Discrimination; Gender-based biases; Hiring behavior; Neighborhood signaling effects; Resume audit; Workplace disparities,,Article,Final,All Open Access; Green Open Access,Scopus,2-s2.0-105020991810
