Authors,Author full names,Author(s) ID,Title,Year,Source title,Volume,Issue,Art. No.,Page start,Page end,Cited by,DOI,Link,Abstract,Author Keywords,Index Keywords,Document Type,Publication Stage,Open Access,Source,EID
Chavez K.,"Chavez, Koji (57200543245)",57200543245,Gendered Pathways to the Job Offer: Stereotypes and Diversity Value during Job Offer Decisions in Software Engineering Hiring,2025,Socius,11,,,,,0,10.1177/23780231251323372,https://www.scopus.com/pages/publications/105000754911?origin=resultslist,"Many corporations in the United States are under pressure to increase gender diversity in professions such as software engineering that have long been dominated by men. Current sociological theory suggests that in response to such pressure, hiring decision makers value women job candidates as potential contributions to gender diversity and incorporate this value into their initial hiring screening decisions. However, it remains unclear whether and how decision makers take diversity into consideration in later hiring stages, namely, during offer decisions, and particularly when there is a strong culture of meritocracy. In this article, the author examines a critical case study of software engineering hiring at a midsized high-technology firm. Drawing on qualitative data, the author finds that diversity considerations do play a role in job offers, but as an implicit motivational force during job offer deliberations rather than an explicitly stated factor. A quantitative analysis complements the qualitative analysis: the author finds no female penalty on receiving an offer where one might be expected, which the author argues is due to implicit diversity considerations during hiring deliberations. The findings of this study have implications for theories of hiring discrimination, cultural fit as a legitimating tool, and motivating reasoning under strong pressures to diversify. © The Author(s) 2025.",discrimination; diversity; gender; organizations; stereotypes,,Article,Final,All Open Access; Gold Open Access; Green Open Access,Scopus,2-s2.0-105000754911
Papoutsoglou M.; Mittas N.; Angelis L.,"Papoutsoglou, Maria (57128423800); Mittas, Nikolaos (23091209400); Angelis, Lefteris (6602528674)",57128423800; 23091209400; 6602528674,Mining people analytics from stackoverflow job advertisements,2017,"Proceedings - 43rd Euromicro Conference on Software Engineering and Advanced Applications, SEAA 2017",,,8051336,108,115,44,10.1109/SEAA.2017.50,https://www.scopus.com/pages/publications/85034456281?origin=resultslist,"Skills and competences of people participating in online professional networks constitute an ever-increasing new source for data collection and analysis. An important sub-domain of human resources management (HRM) is the recruitment process. Job advertisements and people profiles are main parts of recruitment and since are now available online, they constitute a key factor of a new e-recruitment era. Data mining for erecruitment analysis is important in order to extract a knowledge base for people analytics. Skills and competences are the key variables for people analytics and can be drawn from job advertisements. Leveraging the raw information of online job offers, provides a rich source for people analytics. Detecting the appropriate skills and competences for a job from raw text data and associate them with a job seeker is an increasing challenge. The main objective of this paper is the proposal of a framework aiming to collect online job advertisements from a web source which concerns IT job offers and to extract from the raw text the required skills and competences for specific jobs. The selected professional networking web source is StackOverflow and multivariate statistical data analysis was used to test the correlations between skills and competences in the job offers dataset. The present work falls in a relatively new field of research, concerning the competence mining of peopleware data with special focus on software development. © 2017 IEEE.",Competence mining; E-recruitment; Job advertisements; People analytics; Professional social networks,Application programs; Engineering research; Knowledge based systems; Multivariant analysis; Personnel; Professional aspects; Software design; Software engineering; Statistical tests; Websites; Competence mining; Human resources management; Job advertisements; Multivariate statistical data analysis; People analytics; Professional social networks; Recruitment process; Skills and competences; Data mining,Conference paper,Final,,Scopus,2-s2.0-85034456281
Gupta M.; Jindal P.; Kaur M.,"Gupta, Monica (58104455100); Jindal, Priya (57225811404); Kaur, Mandeep (57211291449)",58104455100; 57225811404; 57211291449,SKILL SHORTAGES AND LABOUR MARKET RIGIDITY: AN INTERNATIONAL OUTLOOK,2024,Contemporary Studies in Economic and Financial Analysis,112B,,,87,99,0,10.1108/S1569-37592024000112B005,https://www.scopus.com/pages/publications/85189908892?origin=resultslist,"Introduction: Organisations all over the world are experiencing skill gaps. One of the key factors contributing to the shortage of competent workers is the inability to find candidates that fit the profile. Most of the time, the market does not offer what organisations require. Purpose: This research focuses on skill shortages and labour market rigidity in the information technology (IT) sector. It discusses the impact of labour shortage and strategies to overcome these challenges. Need of the Study: The study is required to reduce the skill shortage in the IT sector and inflexibility in the labour market. Methodology: The data are collected from secondary sources, that is, books, journals and other internet sources. Findings: The labour market volatility is impacted by several external factors leading to rigidity and talent shortages. Different forecasts within the IT industry, manufacturing, media and telecommunications indicate large-scale labour shortages. The growing influence of digitalisation further creates challenges for organisations during the hiring process as the identified skill gaps for IT professionals are also identified. Practical Implications: Labour market rigidity affects the labour market. Shifts in labour supply and demand do not always impact wages. Methods are suggested on how to reduce the rigidity in the labour market and, in turn, decrease the skill gaps. © 2024 by Monica Gupta, Priya Jindal and Mandeep Kaur.",international; IT companies; labour market rigidity; labour supply; market volatility; Skill gaps; skill shortage,,Book chapter,Final,,Scopus,2-s2.0-85189908892
Marouf R.; Kotorov I.; Aslam H.; Krasylnykova Y.; Mazzara M.,"Marouf, Rabab (57346365800); Kotorov, Iouri (57218595977); Aslam, Hamna (57193924846); Krasylnykova, Yuliya (57218596308); Mazzara, Manuel (8557895400)",57346365800; 57218595977; 57193924846; 57218596308; 8557895400,SUCCESSFUL JOB INTERVIEW: GRANULATED MESSAGE FROM INDUSTRY TO IT GRADUATES,2024,"Proceedings of the 21st International Conference on Cognition and Exploratory Learning in the Digital Age, CELDA 2024",,,,401,406,0,,https://www.scopus.com/pages/publications/85214034601?origin=resultslist,"This paper sheds light on the challenge in the Information Technology (IT) and Software Engineering (SE) industries where computer science graduates face a Catch-22 situation, requiring job experience for employment but lacking opportunities to gain it. The literature background and case study examine the demands and dynamics of the IT job market. The case study outcomes are aligned with the insights drawn from the literature. Hence, this paper offers a nuanced exploration of the elements that define a successful applicant profile in the IT sector as well as valuable insights to guide both candidates and employers in navigating job interviews. Focusing on the critical aspect of limited job experience, this study advocates for a strategic alignment of skills transcending formal work history. The gained insights guide both candidates, educational institutions, and employers in navigating the complexities of IT job interviews and contribute to the development of a workforce prepared for future challenges. © 2024 Proceedings of the 21st International Conference on Cognition and Exploratory Learning in the Digital Age, CELDA 2024. All rights reserved.",Applicant Profile; Hiring Practices; Information Technology (IT); Job Experience; Soft Skills; Software Engineering (SE),Applicant profile; Case-studies; Engineering industries; Hiring practices; Information technology; Job experience; Job interviews; Soft skills; Software engineering; Technology graduates,Conference paper,Final,,Scopus,2-s2.0-85214034601
Singer L.; Filho F.F.; Cleary B.; Treude C.; Storey M.-A.; Schneider K.,"Singer, Leif (35079515300); Filho, Fernando Figueira (23008295700); Cleary, Brendan (55486255900); Treude, Christoph (23135531900); Storey, Margaret-Anne (7005753655); Schneider, Kurt (35276019200)",35079515300; 23008295700; 55486255900; 23135531900; 7005753655; 35276019200,Mutual assessment in the social programmer ecosystem: An empirical investigation of developer profile aggregators,2013,"Proceedings of the ACM Conference on Computer Supported Cooperative Work, CSCW",,,,103,116,89,10.1145/2441776.2441791,https://www.scopus.com/pages/publications/84874850721?origin=resultslist,"The multitude of social media channels that programmers can use to participate in software development has given rise to online developer profiles that aggregate activity across many services. Studying members of such developer profile aggregators, we found an ecosystem that revolves around the social programmer. Developers are assessing each other to evaluate whether other developers are interesting, worth following, or worth collaborating with. They are self-conscious about being assessed, and thus manage their public images. They value passion for software development, new technologies, and learning. Some recruiters participate in the ecosystem and use it to find candidates for hiring; other recruiters struggle with the interpretation of signals and issues of trust. This mutual assessment is changing how software engineers collaborate and how they advance their skills. Copyright 2013 ACM.",Gamification; Motivation; Reputation; Social code sharing; Social media; Software development; Software engineering; Virtual communities,Code sharing; Empirical investigation; Gamification; Media channel; Public image; Reputation; Social code sharing; Social media; Virtual community; Social software,Conference paper,Final,All Open Access; Green Open Access,Scopus,2-s2.0-84874850721
Chinn D.; Vandegrift T.,"Chinn, Donald (7005655965); Vandegrift, Tammy (55663719300)",7005655965; 55663719300,What students say about gender in hiring software professionals,2008,"Proceedings of the Conference on Integrating Technology into Computer Science Education, ITiCSE",,,1384386,344,,0,10.1145/1384271.1384386,https://www.scopus.com/pages/publications/57349172974?origin=resultslist,"We asked students to make hiring decisions for a program manager and a software engineer for a fictitious software company. In one population of students, a pool of four candidates was provided. In another population of students, the candidates differed from the first in that the descriptions of two of the candidates were represented by the opposite gender. This poster provides evidence to help answer the following research questions: 1) Does gender matter in the rate of selection among candidates? and 2) Does gender matter in how candidates are perceived? Through analyzing students' work, we show that gender plays a role: the female candidate is more popular and assumptions and perceptions about candidates vary with gender.",Ethics; Gender; Hiring criteria,Computers; Diffractive optical elements; Education computing; Employment; Innovation; Students; Ethics; Gender; Hiring criteria; Program managers; Research questions; Software companies; Software Engineers; Software professionals; Computer software,Conference paper,Final,,Scopus,2-s2.0-57349172974
,,,"IASTED Multiconferences - Proceedings of the IASTED International Conference on Software Engineering, SE 2013",2013,"IASTED Multiconferences - Proceedings of the IASTED International Conference on Software Engineering, SE 2013",,,,,,0,,https://www.scopus.com/pages/publications/84875540127?origin=resultslist,The proceedings contain 18 papers. The topics discussed include: the user information-based mobile application recommender system; towards r&d as innovation experiment systems: a framework for moving beyond agile software development; software requirement acquisition method based on probabilistic action-model algorithm; investigating the candidate pair generation of the VF2 algorithm; evaluating and improving design patterns applicability with metrics; experienced benefits of continuous integration in industry software product development: a case study; interview guidelines for analyzing software architectural practices in agile projects; integration of functional and interface requirements of an web based software: a VDM based formal approach; using AHP to compare and evaluate software security testing techniques; and influence of code completion methods on the usability of APIS.,,,Conference review,Final,,Scopus,2-s2.0-84875540127
Ashrafi S.; Majidi B.; Akhtarkavan E.; Hajiagha S.H.R.,"Ashrafi, Saeed (58701231100); Majidi, Babak (15845948800); Akhtarkavan, Ehsan (36522152100); Hajiagha, Seyed Hossein Razavi (55207319600)",58701231100; 15845948800; 36522152100; 55207319600,Efficient Resume-Based Re-Education for Career Recommendation in Rapidly Evolving Job Markets,2023,IEEE Access,11,,,124350,124367,20,10.1109/ACCESS.2023.3329576,https://www.scopus.com/pages/publications/85177219682?origin=resultslist,"The impact of the COVID-19 pandemic and the introduction of artificial intelligence-based tools created significant job losses across various sectors in all countries around the world. A large portion of these job losses is permanent. Furthermore, the hidden unemployment numbers are higher than currently reported and the impact of Generative Pretrained Transformer (GPT) based tools will further increase the unemployed population in the coming years. Most businesses are likely to experience significant disruptions to their business-as-usual operations and will face business underperformance for long periods. To ensure business continuity and a smooth recovery process following severe disruptions, it is crucial to establish a recovery strategy. To provide enough workforce for the recovery strategy of various businesses, a large-scale rapid re-education of the workforce is required. Intelligent and virtual workplaces will replace traditional offices in various sectors in the upcoming years and many low-skilled jobs are in danger of being permanently lost. In this paper, an artificial intelligence-based framework for rapid work-skill re-education for evolving markets named Career-gAIde is presented. The proposed framework uses automatic analysis of the job resume of the workers for recommendations of a suitable new job with a higher salary and the best rapid re-education path toward that job. Custom build deep neural networks based on CNN-Random along with customized natural language processing tools are designed for large-scale automatic recommendation of a personalized education and career path to each job seeker. The proposed work is focused on software engineering job search and resume upgrades. There is also a book recommendation module for obtaining the knowledge of job seekers. Precision criteria were used to evaluate the job offer recommendations and the proposed framework achieves 67% in this measure. The Recall criteria were used to assess the required skills, with results of 84% and 79%, respectively. The experimental results show that the proposed framework can provide a solution for rapid work-skill re-adjustment for large-scale workforces.  © 2013 IEEE.",deep neural networks; Job recommender system; learning path recommender; natural language processing,Commerce; Compensation (personnel); Employment; Natural language processing systems; Personnel training; Recovery; Software engineering; Job loss; Job recommender systems; Job seekers; Language processing; Large-scales; Learning path recommende; Learning paths; Natural language processing; Natural languages; Recovery strategies; Deep neural networks,Article,Final,All Open Access; Gold Open Access; Green Open Access,Scopus,2-s2.0-85177219682
Satpal; Singh R.; Dhillon M.,"Satpal (58807104100); Singh, Rajbir (59089552600); Dhillon, Manju (57213192739)",58807104100; 59089552600; 57213192739,Impact of factors affecting employee retention on turnover intentions: In Indian IT sector,2019,International Journal on Emerging Technologies,10,4,,273,282,1,,https://www.scopus.com/pages/publications/85077690213?origin=resultslist,"Management of employee turnover is very essential condition of human resource management. Hiring the right people is the biggest challenge that HR department faces today. Sometimes candidates are not proficient enough for the job but they say yes to impress the interviewer to get the job, but after some times they realize that there is no match between them and job, so they start looking for another option. Employee Retention has contributed substantially to the economic power of the company, but they face the problem of employee turnover that affects the organization because if the turnover of employees increases in the organization than it will affect the productivity of the organization. So, to improve the productivity and performance of the organization current study is conducted. The current study is an attempt to identify the impact of factors (Organizational, HR, Personal and Job-related) on the turnover intentions amongst the employee's in Indian IT Sector. Data was collected from 660 employee's working in Indian IT Sector. Primary data is collected from five major IT companies i.e. Wipro, Infosys, HCL, Accenture and HCL. Various dimensions of both the constructs are available in the literature but selected dimensions of both the constructs are used for drawing inferences that help organizations in identifying factors that affect turnover intentions. © 2019, Research Trend. All rights reserved.","Employee retention; Factors (Organizational, HR, Personal and Job related); IT Sector; Turnover intentions",,Article,Final,,Scopus,2-s2.0-85077690213
"Oliveira M., Jr.; Ghiotto G.; Braga R.; David J.","Oliveira, Marcio (57204016216); Ghiotto, Gleiph (56607130200); Braga, Regina (7006111233); David, Jose (18433696900)",57204016216; 56607130200; 7006111233; 18433696900,Recommending external developers to software projects based on historical analysis of previous contributions,2019,ACM International Conference Proceeding Series,,,,417,426,3,10.1145/3350768.3352458,https://www.scopus.com/pages/publications/85073196439?origin=resultslist,"The software development industry has evolved in recent years and new challenges have emerged. One of them is the difficulty in recruiting developers who are familiar with technologies that may be important to global software development projects. Currently, this task is aided by tools that delegate the mission of actively seeking developers to human recruiters. Unfortunately, when delegating such a task to humans, these tools may miss opportunities, as they may not be able to find all the information about the candidates. Following the methodology of Design Science Research (DSR), this work presents an architecture that helps to find collaborators for projects, along with an ontology. By mining social-coding repositories, the architecture can provide information, through inference (e.g. dependencies in projects in which developers worked) to be used in the recommendation tasks. An initial feasibility study was conducted to assess the feasibility to recommend developers to projects on the Node.js ecosystem. The recommendation system analyzes the previous contributions of the developers in other projects (n = 7000) and extracts technologies in which they explicitly worked and those they may be familiar as they are present in projects they worked with. After, the system compares them to a set of technologies that are part of the project that is the target of the recommendation. The feasibility study evidenced that the architecture can aid in the task of identifying candidates and technologies known to them. © 2019 Association for Computing Machinery.",Developers recruitment; Global software development; Ontologies; Software repositories mining,Engineering research; Ontology; Planning; Design science researches (DSR); Developers recruitment; Feasibility studies; Global software development; Historical analysis; Software project; Software repositories; Software design,Conference paper,Final,,Scopus,2-s2.0-85073196439
Marasco J.,"Marasco, Joe (57505364400)",57505364400,Silver bullets: No secret ingredients,2012,IEEE Software,29,3,6188604,104+102,103,0,10.1109/MS.2012.48,https://www.scopus.com/pages/publications/84860442153?origin=resultslist,"Lists of things to look for in project candidates and cultures are often useless because they are too long and unprioritized. We seek clarity in requiring that such lists contain no more than three items each. In so doing, we focus on what is essential, rather than on what is nice to have. The featured Web extra is a presentation by the author about the key ingredients to building a strong team. © 1984-2012 IEEE.",culture; project; recruiting; software,Cell culture; Computer software; project; recruiting; Software engineering,Article,Final,,Scopus,2-s2.0-84860442153
Shankhdhar A.; Gupta A.; Singh A.K.; Pradhan R.,"Shankhdhar, Ashutosh (57205185294); Gupta, Anurag (57190435546); Singh, Akhilesh Kumar (60058803500); Pradhan, Rahul (56405242900)",57205185294; 57190435546; 60058803500; 56405242900,A Vocational Career Advisory Application Built Using Unsupervised Machine Learning Frameworks,2022,Lecture Notes in Electrical Engineering,836,,,471,480,1,10.1007/978-981-16-8542-2_38,https://www.scopus.com/pages/publications/85130264753?origin=resultslist,"As freshers experience their examinations and follow their intrigued courses, it is significant for them to evaluate their qualities and perceive their inclinations so as to make sense of in which vocation field their inclinations and abilities would get them. It will assist them with improving their yield and motivate their wants to be engaged at their planned profession and settle in that. Likewise, for recruiters when employing candidates in the wake of surveying them in every single different way, these profession suggestion frameworks assists them with deciding the job title the candidate ought to be held in depending on his/her outcomes and different evaluations. This paper centers essentially around the prediction of the software engineering space of applicants in the vocation field. Most appropriate space as per interests and capabilities of the applicant is anticipated and reasonable employment opportunities pertinent to the area are shown. The fresher can go after his favored position from the arrangement of employments shown. © 2022, The Author(s), under exclusive license to Springer Nature Singapore Pte Ltd.",Decision tree; Label encoding; Machine learning; Student career advisory application; SVM,Employment; Machine learning; Quality control; Signal encoding; Software engineering; Application builds; Employment opportunities; Label encoding; Learning frameworks; Student career advisory application; SVM; Unsupervised machine learning; Decision trees,Conference paper,Final,,Scopus,2-s2.0-85130264753
