Authors,Author full names,Author(s) ID,Title,Year,Source title,Volume,Issue,Art. No.,Page start,Page end,Cited by,DOI,Link,Abstract,Author Keywords,Index Keywords,Document Type,Publication Stage,Open Access,Source,EID
Kucukozyigit A.; Rayavarapu L.; Shaik S.,"Kucukozyigit, Ali (59661626100); Rayavarapu, Lalitha (60572183200); Shaik, Suhail (60572287500)",59661626100; 60572183200; 60572287500,A SYSTEMATIC REVIEW OF SYSTEMS ENGINEERING JOB OPPORTUNITIES: WHAT SKILLS ARE INDUSTRY EMPLOYERS REQUIRING FOR THEIR POSITIONS OFFERED?,2025,"Proceedings of the 2025 International Annual Conference and 46th Annual Meeting: Powering the Future of Engineering Management, ASEM 2025",,,,600,609,0,,https://www.scopus.com/pages/publications/105035383351?origin=resultslist,"The industry greatly values the practical skills needed in Engineering Management and Systems Engineering. Systems are defined as a group of interconnected elements that together create a pattern over time, which individual components cannot achieve on their own. Systems engineering (SE) uses an interdisciplinary approach to model and predict system dynamics, constraints, and conditions. The design and development of these systems incorporate scientific principles, mathematical modeling, and practical considerations such as cost, safety, and the environment. Because systems thinking takes a holistic view that encompasses business, managerial, and technical aspects, individuals with these skills are in high demand. Therefore, SEs must blend managerial, technical, and soft skills. The methodology utilized in this study is Data Integration and Visualization. The research question aimed to identify software engineering (SE) job opportunities as advertised by employers and the necessary skills required for the applicants. Data was collected from 79 job postings, primarily on ZipRecruiter, LinkedIn, and Indeed. The job postings were analyzed to gather information on technical and soft skills, experience, education, security clearance requirements, geographical locations, as well as other data points such as travel, salary, and benefits necessary to pursue professional SE job positions. The findings of this data analysis work provide valuable insights for educational institutions to align their curriculum with industry requirements. Additionally, the insights offer valuable information to job seekers regarding salary, location, education, and the types of skills required for SE positions. © American Society for Engineering Management, 2025.",Job market analysis for Systems Engineers; Skills required for Systems Engineers (SE); Systems Engineering (SE),Data visualization; Employment; Engineering education; Engineers; Software engineering; System theory; Wages; Engineering jobs; Job market; Job market analyze for system engineer; Job opportunities; Market analysis; Skill required for system engineer; System engineering; System engineers; Technical skills; Data integration,Conference paper,Final,,Scopus,2-s2.0-105035383351
Ahmad M.M.; Srivastava P.; Bharti V.; Shamsi M.F.; Jain A.; Vishnoi A.,"Ahmad, Mohd Mawan (58622596100); Srivastava, Prateek (56405060400); Bharti, Vaibhav (59374413900); Shamsi, Mohd Faraz (59374138100); Jain, Amit (59098043600); Vishnoi, Ankit (57193865788)",58622596100; 56405060400; 59374413900; 59374138100; 59098043600; 57193865788,Collaborative Mock Interview Platform,2024,"2024 OPJU International Technology Conference on Smart Computing for Innovation and Advancement in Industry 4.0, OTCON 2024",,,,,,1,10.1109/OTCON60325.2024.10687866,https://www.scopus.com/pages/publications/85206898051?origin=resultslist,"The collaborative mock interview platform is a pioneering solution addressing the imperative need for streamlined preparation and evaluation in data structures and algorithms (DSA) interviews within the contemporary technological landscape. Recognizing the pivotal role DSA interviews play in shaping the careers of aspiring computer students, the platform offers a vibrant, interactive space with features like real-time video streaming, shared coding environments, and automated code testing using cutting-edge technologies such as WebRTC. Driven by key principles, including the educational significance of DSA interviews and the multifaceted nature of preparation, the project aims to bridge the gap between theoretical understanding and practical application, providing users with an authentic DSA interview experience to foster problem-solving skills, effective communication, and real-time interaction. Beyond interview readiness, the platform promotes continuous improvement in technical skills, collaborative learning, and self-confidence. Prioritizing accessibility and inclusivity, it caters to users from diverse backgrounds, and its innovation in assessment, versatility for educators, learners, job seekers, and professionals, and commitment to adaptability ensure its relevance in the evolving landscape of technical interviews. In essence, the Collaborative Mock Interview Platform serves as a cornerstone for individuals aspiring to succeed in the technology sector, offering a unique, accessible, and dynamic arena for DSA interview preparation and fostering the growth of the next generation of technology professionals.  © 2024 IEEE.",DSA; HTTP; Interview; Peer-to-Peer connection; Protocols; Sockets; Web Sockets; WebRTC,Authentication Protocol; Code division multiple access; Computer programming languages; HTTP; Hypertext systems; Interactive computer graphics; Mockups; Peer to peer networks; Websites; Automated code; Cutting edge technology; Data structure and algorithm; Interactive spaces; Interview; Peer-to-peer connections; Real-time videostreaming; Socket; Web socket; WebRTC; Video streaming,Conference paper,Final,,Scopus,2-s2.0-85206898051
Farinola L.A.; Farinola T.P.,"Farinola, Lawrence A. (60310886500); Farinola, Toochi P. (60311066400)",60310886500; 60311066400,Essential Non-Technical Skills for Software Engineering and Engineering Science Graduates: A Case Study from North Cyprus,2025,Journal of Technical Education and Training,17,4,,94,101,0,10.30880/jtet.2025.17.04.008,https://www.scopus.com/pages/publications/105027020072?origin=resultslist,"This quantitative descriptive study examines key non-technical (soft) skills influencing the employability of software engineering and engineering sciences graduates in North Cyprus. A total of 50 stakeholders—comprising university lecturers, industry experts, postgraduate students, recent graduates, and job seekers— participated in a structured survey featuring 57 items across nine skill categories. Quantitative analysis using descriptive statistics (means, frequencies, standard deviations) revealed that skills such as contextual problem-solving, written communication, patience, leadership, brainstorming, professionalism, responsibility, planning, and empathy received mean scores above 3.5 on a 5-point scale, demonstrating strong perceived importance in recruitment processes. Findings underscore a notable gap in current engineering curricula regarding non-technical skills training. To address this, we advocate for the systematic integration of soft-skills development into university programs and recommend enhanced partnerships between academia and industry to improve workforce readiness. © 2025, Penerbit UTHM. All rights reserved.",engineering curriculum; graduate employability; non-technical competencies; North Cyprus; soft skills; Software engineering education,,Article,Final,All Open Access; Gold Open Access,Scopus,2-s2.0-105027020072
Rathnayake D.I.; Mahendra D.N.; Amarasinghe B.C.; Premaratne S.C.; Buhari M.M.,"Rathnayake, Devin I. (58938399200); Mahendra, Damitha N. (58938609700); Amarasinghe, Bhathiya C. (58938399300); Premaratne, Saminda C. (55315708900); Buhari, Mufitha M. (57216458772)",58938399200; 58938609700; 58938399300; 55315708900; 57216458772,Next Generation Technical Interview Process Automation with Multi-level Interactive Chatbot Based on Intelligent Techniques,2024,Lecture Notes in Networks and Systems,834,,,93,103,1,10.1007/978-981-99-8349-0_8,https://www.scopus.com/pages/publications/85187679647?origin=resultslist,"Automated the demand for automated interview systems is high due to the time and cost involved in traditional interview processes. In the field of software engineering, automating technical interviews provides convenience for assessing candidates’ technical competency during recruitment. This study proposes three key modules for an automated selection process in information technology organizations: a technology-oriented resume analysis module, an intelligent interview Chatbot, and a self-confidence level analysis module. The Chatbot conducts open-ended interviews, offering a novel approach to technical discussions. The resume analysis module evaluates candidates’ technology competency based on indicated skills. The self-confidence level analysis module analyzes candidates’ facial expressions and confidence levels through video and audio features, respectively. Each module is assigned a separate score, and a weighted average score is calculated as the final score. This novel approach addresses drawbacks identified in existing literature, enhancing the automated technical interview process. The study provides technical and empirical evidence supporting the potential of maximizing automated technical interviews. © The Author(s), under exclusive license to Springer Nature Singapore Pte Ltd. 2024.",AI enhanced technical interview; Audio analysis; Conversational AI; Image processing; Machine learning; Natural language processing; Resume analysis first section,Automation; Image enhancement; Learning algorithms; Natural language processing systems; Software engineering; AI enhanced technical interview; Audio analysis; Chatbots; Conversational AI; Images processing; Language processing; Machine-learning; Natural language processing; Natural languages; Resume analyse first section; Machine learning,Conference paper,Final,,Scopus,2-s2.0-85187679647
Kato J.; Komiya S.; Saeki M.; Ohnishi A.; Nagata M.; Yamamoto S.; Horai H.,"Kato, Junzo (7402069345); Komiya, Seiichi (7102637990); Saeki, Motoshi (7202299264); Ohnishi, Atsushi (35318265800); Nagata, Morio (55184321500); Yamamoto, Shuichiroh (55578898600); Horai, Hisayuki (57213630699)",7402069345; 7102637990; 7202299264; 35318265800; 55184321500; 55578898600; 57213630699,A model for navigating interview processes in requirements elicitation,2001,"Proceedings of the Asia-Pacific Software Engineering Conference and International Computer Science Conference, APSEC and ICSC",,,,141,148,10,10.1109/APSEC.2001.991470,https://www.scopus.com/pages/publications/0035690045?origin=resultslist,"Experts in requirements elicitation have interviews to stakeholders using various levels of knowledge to grasp and elicit user's requirements. This paper analyzes interview processes of these experts and explores a computation model for simulating them. This model can be used to navigate novice analysts' interview processes. It is a mixture consisting of a blackboard model and a state transition model in order to narrow the candidates for the questions that an expert analyst will ask the stakeholders next in the interview process. The candidates are selected based on the information that has been elicited from the stakeholders until now, and the blackboard model is for holding this information in the form of IEEE 830, a standard form of requirements specification documents. We have analyzed the experts' interview processes and constructed the instance of the computation model in sales management domain. And we recorded novices' processes, simulated it on the novices' ones, and showed that we could improve them by means of the model.",,Computer simulation; Mathematical models; Software engineering; Specifications; Requirements elicitation; Software requirements specification; Requirements engineering,Conference paper,Final,,Scopus,2-s2.0-0035690045
Zaidan A.A.; Zaidan B.B.; Alsalem M.A.; Momani F.; Zughoul O.,"Zaidan, A.A. (58789685700); Zaidan, B.B. (35070872100); Alsalem, M.A. (57200572842); Momani, Fayiz (57204661732); Zughoul, Omar (57204659906)",58789685700; 35070872100; 57200572842; 57204661732; 57204659906,Novel Multiperspective Hiring Framework for the Selection of Software Programmer Applicants Based on AHP and Group TOPSIS Techniques,2020,International Journal of Information Technology and Decision Making,19,3,,775,847,25,10.1142/S0219622020500121,https://www.scopus.com/pages/publications/85086800250?origin=resultslist,"The selection of software programmer applicants based on multiperspective evaluation criteria (grade point average (GPA) and soft skills of the applicants) is needed instead of an interview because an interview does not necessarily lead to hiring the best candidate amongst the applicants. The selection of a suitable software programmer is considered a challenging task owing to the following factors: (1) data variation, (2) multiple evaluation criteria and (3) criterion importance. A general framework for the selection of the best software programmer applicants is not available in the existing literature. The present study aims to propose a novel multiperspective hiring framework based on multicriteria analysis to select the best software programmer amongst several applicants. A decision matrix (DM) is constructed for the selection of the best programmer applicants according to multiple criteria, namely, structured programming, object-oriented programming, data structure, database system and courseware engineering. Each criterion includes two parameters, namely, GPA and soft skills, and these criteria cross over with programmer applicants as alternatives. The standard and expert opinion of the Software Engineering Body of Knowledge is used to distribute the criteria in the DM. The two commonly used techniques of multicriteria decision-making are analytic hierarchy process (AHP) for weighing the criteria and technique for order performance by similarity to ideal solution (TOPSIS) for ranking the alternatives (programmer applicants). The data used in this study include 60 software engineering students who graduated in 2016 from Universiti Pendidikan Sultan Idris. Results show that integrating multilayer analytic hierarchy process (MLAHP) and group TOPSIS are effective for solving applicant selection problems. Group TOPSIS uses different contexts-internal and external aggregation-and indicates similar results. Objective validation is used for the ranking of the results, which are equally divided into four parts. Furthermore, the applicants are systematically ranked. This study benefits application software, system software and computer programming tool companies by providing a method that improves software quality whilst reducing time and cost in the selection process. © 2020 World Scientific Publishing Company.",AHP; MCDM; measurement criteria; Multicriteria decision-making techniques; software programmer; TOPSIS,Analytic hierarchy process; Application programs; Computer software selection and evaluation; Computer systems programming; Decision making; Employment; Hierarchical systems; Object-oriented databases; Software quality; Structured programming; Analytic hierarchy process (ahp); Computer programming tools; Grade point average; Multi Criteria Analysis; Multi criteria decision making; Selection of software; Software engineering body of knowledge; Software engineering students; Object oriented programming,Article,Final,,Scopus,2-s2.0-85086800250
Ozyurt O.; Gurcan F.; Dalveren G.G.M.; Derawi M.,"Ozyurt, Ozcan (35614751000); Gurcan, Fatih (57194776706); Dalveren, Gonca Gokce Menekse (57201658878); Derawi, Mohammad (35408917600)",35614751000; 57194776706; 57201658878; 35408917600,Career in Cloud Computing: Exploratory Analysis of In-Demand Competency Areas and Skill Sets,2022,Applied Sciences (Switzerland),12,19,9787,,,29,10.3390/app12199787,https://www.scopus.com/pages/publications/85139778969?origin=resultslist,"This study aims to investigate up-to-date career opportunities and in-demand competence areas and skill sets for cloud computing (CC), which plays a crucial role in the rapidly developing teleworking environments with the COVID-19 pandemic. In this paper, we conducted a semantic content analysis on 10,161 CC job postings using semi-automated text-mining and probabilistic topic-modeling procedures to discover the competency areas and skill sets as semantic topics. Our findings revealed 22 competency areas and 46 skills, which reflect the interdisciplinary background of CC jobs. The top five competency areas for CC were identified as “Engineering”, “Development”, “Security”, “Architecture”, and “Management”. Besides, the top three skills emerged as “Communication Skills”, “DevOps Tools”, and “Software Development”. Considering the findings, a competency-skill map was created that illustrates the correlations between CC competency areas and their related skills. Although there are many studies on CC, the competency areas and skill sets required to deal with cloud computing have not yet been empirically studied. Our findings can contribute to CC candidates and professionals, IT organizations, and academic institutions in understanding, evaluating, and developing the competencies and skills needed in the CC industry. © 2022 by the authors.",cloud computing; competency areas; job-posting analysis; skill requirements; text mining; topic modeling,,Article,Final,All Open Access; Gold Open Access; Green Open Access,Scopus,2-s2.0-85139778969
Di Stasio V.,"Di Stasio, Valentina (56419857200)",56419857200,Education as a signal of trainability: Results from a vignette study with Italian employers,2014,European Sociological Review,30,6,,796,809,88,10.1093/esr/jcu074,https://www.scopus.com/pages/publications/84925603542?origin=resultslist,"Drawing on queuing theory, this study explores the relationship between education and labour market entry from the perspective of employers. On the basis of vignette study, we simulated a hiring process with a sample of recruiters and human resource managers. We analysed the role of education in the screening of applicants' resumes for job openings in the Information, Communication, and Technology sector in the Italian labour market. Findings reveal that employers attach importance to fine-grained indicators of school performance, such as grades and study duration to formulate their hiring decisions, in line with queuing theory. However, internships are disregarded as signals. Results are explained in light of the institutional arrangements that characterize the Italian school-to-work transition system: a standardized education system, poorly specific vocational tracks, weakly developed linkages between schools and firms, a remarkably high dropout rate before study completion. © 2014 © The Author 2014. Published by Oxford University Press. All rights reserved.",,,Article,Final,,Scopus,2-s2.0-84925603542
Gupta S.; Hingwala A.; Haryan Y.; Gharat S.,"Gupta, Suraj (57223129520); Hingwala, Atif (57223124889); Haryan, Yuvraj (57223134098); Gharat, Swapnil (57200984653)",57223129520; 57223124889; 57223134098; 57200984653,Recruitment System with Placement Prediction,2021,"Proceedings - International Conference on Artificial Intelligence and Smart Systems, ICAIS 2021",,,9395768,669,673,16,10.1109/ICAIS50930.2021.9395768,https://www.scopus.com/pages/publications/85104934391?origin=resultslist,The availability of information and the facility for the user to take action on the information collected have been revolutionized by the use of the Internet and the World Wide Web. The placement process can be managed using the internet which arises a need to develop a web-based placement management system specifically by the recruiters and the software engineers that can be used as a Recruitment system (Online TnP portal). This system can be used as an application for both candidates and recruiters. Advanced features for recruiters are available as they can shortlist candidates for further rounds according to their requirements on the basis of the probability obtained. The current recruitment system recruiters do not possess candidate information apart from his/her CV. This proposed system aims to analyze the candidate performance and recommend candidates fittest for the job using Random Forest Regressor algorithm that will help to maximize the placement probability of candidates easing the recruiter's task. Random Forest builds multiple decision trees and merges them together to get a more accurate and stable prediction. This system will provide ease and efficiency in recruitment process.  © 2021 IEEE.,Placement Probability; Random Forest Regressor; Recruitment System,Decision trees; Random forests; Management systems; Placement process; Recruitment process; Web based; Artificial intelligence,Conference paper,Final,,Scopus,2-s2.0-85104934391
Jodis Stephen M.,"Jodis, Stephen M. (6603126953)",6603126953,Experiences and successes in teaching a language many CS students didn't want to learn: COBOL,1995,Proceedings of the Annual Southeast Conference,,,,273,274,0,,https://www.scopus.com/pages/publications/0029179625?origin=resultslist,"Many computer science students see no value in taking a COBOL programming course until they begin to notice the number of job advertisements applicant to have knowledge of the language. Even if students are aware that knowledge of the COBOL language could help them to locate an entry level job, many still find the course to be less than exciting. The presentation of the COBOL course has evolved over the past four years from an introduction to COBOL programming, to introduction to COBOL via a software engineering approach, to introduction to COBOL, software engineering, and how it applies to real world events and situations. Over these years the response of the students to the course has improved, the amount of material covered has increased, and students are finding jobs which require knowledge of COBOL.",,Computer programming; Computer science; Engineering education; Teaching; Computational linguistics; Computer programming; Education; Software engineering; Students; Teaching; Computer science students; Programming course; Real-world; COBOL programming; Computer science students; COBOL (programming language); COBOL (programming language),Conference paper,Final,,Scopus,2-s2.0-0029179625
Francillette Y.; Boucher E.; Bier N.; Lussier M.; Bouchard K.; Belchior P.; Gaboury S.,"Francillette, Yannick (35867785900); Boucher, Eric (57196484628); Bier, Nathalie (10242573100); Lussier, Maxime (36651204700); Bouchard, Kévin (36170286900); Belchior, Patricia (8366827500); Gaboury, Sébastien (25627749700)",35867785900; 57196484628; 10242573100; 36651204700; 36170286900; 8366827500; 25627749700,Modeling the behavior of persons with mild cognitive impairment or Alzheimer’s for intelligent environment simulation,2020,User Modeling and User-Adapted Interaction,30,5,,895,947,10,10.1007/s11257-020-09266-4,https://www.scopus.com/pages/publications/85086860601?origin=resultslist,"Intelligent environments may improve the independence and quality of life of persons with mild cognitive impairment (MCI) or Alzheimer’s disease (AD) through their ability to automatically provide assistance or guidance. In order to deploy these systems in this category of the population, it is necessary to be able to carry out validation and experiments to improve efficiency, safety, user experience and reduce installation costs. Unfortunately, this type of experiment can be difficult to perform because of the difficulty in recruiting candidates and accessing adequate intelligent environments. These problems could be partially offset with simulators. These tools can be used to simulate the behavior of an intelligent environment and its occupants in order to generate data, or to observe and evaluate their behavior. However, to design systems for populations suffering from MCI or AD, it is necessary that the simulator be able to emulate the behavior of these persons. In this paper, two approaches to simulate and generate sequences of actions containing errors usually committed by persons with this type of disease are proposed. Those approaches aim to be simple to use and both are based on the use of behavior trees. The first one consists in adding nodes to a behavior tree to simulate errors with their specific probabilities. The second approach consists in defining an interval to bind the number of errors that can be inserted through the error injection algorithm. We also present the results of the experiments carried out to evaluate these approaches. For the first experiment, several simulations were conducted and were recorded in videos. These videos were analyzed by specialists in cognitive disorders who diagnosed the avatar of these videos. The second experiment aimed at comparing the two approaches together. To do so, several action sequences were generated. The results show that our model is able to generate healthy, MCI and Alzheimer’s behaviors. The results also show that the second approach facilitates the generation of a desired number of errors. © 2020, Springer Nature B.V.",Alzheimer; Error simulation; Intelligent environment; Mild cognitive impairment; Simulation; Simulation of activity of daily life,Errors; Forestry; Intelligent agents; User experience; Action sequences; Behavior trees; Error injection; Installation costs; Intelligent environment; Mild cognitive impairments; Mild cognitive impairments (MCI); Quality of life; Computer aided software engineering,Article,Final,All Open Access; Green Open Access,Scopus,2-s2.0-85086860601
